{
  "case_id": "v22-dev-physics-circuit-style-cleanup",
  "split": "development",
  "subject": "physics",
  "source_image": "benchmarks/exam-diagram-engine-v2/inputs/reference/physics/series-circuit-switch.png",
  "user_instruction": "원본 회로의 구조와 배치를 그대로 유지하고, 문자와 빨간 화살표만 제거하여 평가원식 흑백 선화로 정리한다.",
  "source_inventory": [
    "one battery with distinct long and short plates",
    "one open switch with two separated contacts",
    "one bulb",
    "one series wire path interrupted only by battery and switch"
  ],
  "source_annotations_to_remove": [
    "upper-left source text",
    "red leader arrow",
    "lower-right panel marker"
  ],
  "operations": [
    {
      "type": "style_cleanup",
      "target": "entire source image",
      "change": "remove annotations and color while preserving all scientific geometry, topology, and empty regions"
    }
  ],
  "locked_invariants": [
    "battery remains on the lower-left part of the loop",
    "switch remains open and is the only switch gap",
    "bulb remains on the lower-right conductor",
    "upper and lower conductors terminate at different battery plates",
    "no wire crossing or bypass is introduced"
  ],
  "expected_assertions": [
    "all three scientific components remain present exactly once",
    "the circuit topology and component positions match the source",
    "all source annotations and red color are absent"
  ],
  "allowed_gray_regions": [],
  "critical_uncertainties": []
}
